id,question
1854a837-c766-4823-9e32-bc64f73a1710,What is the main cooking method used to prepare Mole Poblano?
1854a837-c766-4823-9e32-bc64f73a1710,At what temperature should Mole Poblano be served?
37dd984d-55a6-447e-866e-0c31e72bfeaf,What type of protein is used in the Pad Kra Pao dish?
37dd984d-55a6-447e-866e-0c31e72bfeaf,How long does it take to cook the Pad Kra Pao meal?
37dd984d-55a6-447e-866e-0c31e72bfeaf,Is the Pad Kra Pao meal suitable for vegetarians?
37dd984d-55a6-447e-866e-0c31e72bfeaf,What is the main cooking method used to prepare the Pad Kra Pao?
37dd984d-55a6-447e-866e-0c31e72bfeaf,At what temperature should the Pad Kra Pao be served?
726da803-6b23-470e-b469-5ff6a1a855f6,What is the primary protein ingredient in Hainanese Chicken Rice?
726da803-6b23-470e-b469-5ff6a1a855f6,How long does it take to cook Hainanese Chicken Rice?
726da803-6b23-470e-b469-5ff6a1a855f6,Is Hainanese Chicken Rice suitable for a vegetarian diet?
726da803-6b23-470e-b469-5ff6a1a855f6,What is the recommended serving temperature for Hainanese Chicken Rice?
726da803-6b23-470e-b469-5ff6a1a855f6,What are the key steps involved in preparing Hainanese Chicken Rice?
3b67fa90-2723-4dd9-a1fa-47c8e79ddbf0,What are the main ingredients required to make Crepes?
3b67fa90-2723-4dd9-a1fa-47c8e79ddbf0,How long does it take to cook Crepes?
3b67fa90-2723-4dd9-a1fa-47c8e79ddbf0,What is the primary cooking method used for Crepes?
3b67fa90-2723-4dd9-a1fa-47c8e79ddbf0,Can Crepes be served as a vegetarian option?
3b67fa90-2723-4dd9-a1fa-47c8e79ddbf0,What is the recommended temperature for serving Crepes?
b5e4c5c1-7b5b-4c89-a826-3d1a2407e4bc,What type of meat is used in the Meat Pie recipe and how is it prepared?
b5e4c5c1-7b5b-4c89-a826-3d1a2407e4bc,How long does it take to cook the Meat Pie and what is the primary cooking method used?
b5e4c5c1-7b5b-4c89-a826-3d1a2407e4bc,What is the spice level of the Meat Pie and is it suitable for vegetarians?
b5e4c5c1-7b5b-4c89-a826-3d1a2407e4bc,At what temperature should the Meat Pie be served and what is the texture of the filling?
b5e4c5c1-7b5b-4c89-a826-3d1a2407e4bc,What are the main ingredients and steps involved in making the Meat Pie dish?
f654dea0-5a8f-4046-a098-36e40aecb53f,What type of protein is used in the Kebab recipe?
f654dea0-5a8f-4046-a098-36e40aecb53f,How long does it take to cook the Kebab?
f654dea0-5a8f-4046-a098-36e40aecb53f,Is the Kebab suitable for a vegetarian diet?
f654dea0-5a8f-4046-a098-36e40aecb53f,What is the primary method of cooking the Kebab?
f654dea0-5a8f-4046-a098-36e40aecb53f,What is the recommended temperature for serving the Kebab?
60464ffc-060e-428e-96dd-fa80f0aafbf1,What type of meal is Jambalaya classified as
60464ffc-060e-428e-96dd-fa80f0aafbf1,How long does it take to cook Jambalaya in minutes
60464ffc-060e-428e-96dd-fa80f0aafbf1,Is Jambalaya suitable for a vegetarian diet
60464ffc-060e-428e-96dd-fa80f0aafbf1,What is the primary cooking method used to make Jambalaya
60464ffc-060e-428e-96dd-fa80f0aafbf1,At what temperature is Jambalaya typically served
b814e470-a53f-4223-82b0-e407094d5f8d,What type of meal is Churros classified as?
b814e470-a53f-4223-82b0-e407094d5f8d,How long does it take to cook Churros?
b814e470-a53f-4223-82b0-e407094d5f8d,Is Churros suitable for a vegetarian diet?
b814e470-a53f-4223-82b0-e407094d5f8d,What is the primary method used to cook Churros?
b814e470-a53f-4223-82b0-e407094d5f8d,At what temperature should Churros be served?
34092451-cb00-420f-8cf6-d212e6a2462e,What is the primary grain used in this recipe and what type of meal is it?
34092451-cb00-420f-8cf6-d212e6a2462e,Are there any meat products involved in the preparation of this dish?
34092451-cb00-420f-8cf6-d212e6a2462e,How long does it take to prepare this meal and at what temperature is it served?
34092451-cb00-420f-8cf6-d212e6a2462e,What method is used to cook the vegetables and the main ingredient in this recipe?
34092451-cb00-420f-8cf6-d212e6a2462e,Is this recipe considered spicy and what is the main cooking method used for the main ingredient?
f933e365-e3b3-4001-981f-eb5f7a674a42,What is the main cooking method used to prepare the Tofu Stir-Fry dish?
f933e365-e3b3-4001-981f-eb5f7a674a42,How long does it take to cook the Tofu Stir-Fry in minutes?
f933e365-e3b3-4001-981f-eb5f7a674a42,Is the Tofu Stir-Fry suitable for vegetarians?
f933e365-e3b3-4001-981f-eb5f7a674a42,What is the recommended serving temperature for the Tofu Stir-Fry?
f933e365-e3b3-4001-981f-eb5f7a674a42,What spice level can be expected from the Tofu Stir-Fry?
95cbd6cf-659d-4e62-94e9-30cba83a4633,"What type of dish is Paneer Tikka, is it a main course or a starter?"
95cbd6cf-659d-4e62-94e9-30cba83a4633,How long does it take to cook Paneer Tikka in total?
95cbd6cf-659d-4e62-94e9-30cba83a4633,Is Paneer Tikka suitable for people who follow a vegetarian diet?
95cbd6cf-659d-4e62-94e9-30cba83a4633,At what temperature should Paneer Tikka be served to the guests?
95cbd6cf-659d-4e62-94e9-30cba83a4633,What is the main method used to cook Paneer Tikka and what ingredients are used with paneer?
d2c418dd-67c8-4fbc-8369-8d0b26591a4c,What are the main ingredients used to make Kimchi Jjigae?
d2c418dd-67c8-4fbc-8369-8d0b26591a4c,How long does it take to cook Kimchi Jjigae?
d2c418dd-67c8-4fbc-8369-8d0b26591a4c,Is Kimchi Jjigae suitable for vegetarians?
d2c418dd-67c8-4fbc-8369-8d0b26591a4c,What is the recommended serving temperature for Kimchi Jjigae?
d2c418dd-67c8-4fbc-8369-8d0b26591a4c,What is the primary method of cooking used to prepare Kimchi Jjigae?
f946cf79-a23e-413e-a1c1-75d859aefbcf,What type of meal is Dolma typically considered?
f946cf79-a23e-413e-a1c1-75d859aefbcf,How long does it take to cook Dolma?
f946cf79-a23e-413e-a1c1-75d859aefbcf,Is Dolma suitable for vegetarians?
f946cf79-a23e-413e-a1c1-75d859aefbcf,At what temperature is Dolma usually served?
f946cf79-a23e-413e-a1c1-75d859aefbcf,What is the primary method used to cook Dolma?
8d1f94b2-6458-4fb2-a38a-ab67afd6f80a,What is the primary grain used in the Risotto dish?
8d1f94b2-6458-4fb2-a38a-ab67afd6f80a,How long does it take to cook the Risotto?
8d1f94b2-6458-4fb2-a38a-ab67afd6f80a,Is the Risotto suitable for a vegetarian diet?
8d1f94b2-6458-4fb2-a38a-ab67afd6f80a,What is the recommended temperature for serving the Risotto?
8d1f94b2-6458-4fb2-a38a-ab67afd6f80a,What is the first step in preparing the Risotto?
a15f6dba-ad9d-442e-a111-bf9b3a9bd428,What type of meal is Clafoutis considered to be?
a15f6dba-ad9d-442e-a111-bf9b3a9bd428,Is Clafoutis suitable for a vegetarian diet?
a15f6dba-ad9d-442e-a111-bf9b3a9bd428,How long does it take to cook Clafoutis in the oven?
a15f6dba-ad9d-442e-a111-bf9b3a9bd428,At what temperature should Clafoutis be served?
a15f6dba-ad9d-442e-a111-bf9b3a9bd428,What is the primary method used to cook Clafoutis?
6e8f1802-a025-4df4-8b06-cf75d318770c,What is the main ingredient in Bulgur Pilaf?
6e8f1802-a025-4df4-8b06-cf75d318770c,How long does it take to cook Bulgur Pilaf?
6e8f1802-a025-4df4-8b06-cf75d318770c,Is Bulgur Pilaf suitable for a vegetarian diet?
6e8f1802-a025-4df4-8b06-cf75d318770c,What is the recommended serving temperature for Bulgur Pilaf?
6e8f1802-a025-4df4-8b06-cf75d318770c,What cooking method is used to prepare Bulgur Pilaf?
e01946a0-ef66-44e8-8857-4cb0f05e85ec,What type of meal is Shish Taouk considered and what is its spice level?
e01946a0-ef66-44e8-8857-4cb0f05e85ec,How long does it take to cook Shish Taouk and what is the main cooking method used?
e01946a0-ef66-44e8-8857-4cb0f05e85ec,Is Shish Taouk suitable for vegetarians and what is the serving temperature?
e01946a0-ef66-44e8-8857-4cb0f05e85ec,What are the main ingredients used to marinate the chicken in Shish Taouk?
e01946a0-ef66-44e8-8857-4cb0f05e85ec,What are the steps involved in making Shish Taouk and at what temperature is it served?
9d2157b7-74ec-49d1-9f11-a5412af775d4,What type of meal is Panna Cotta classified as?
9d2157b7-74ec-49d1-9f11-a5412af775d4,Is Panna Cotta suitable for a vegetarian diet?
9d2157b7-74ec-49d1-9f11-a5412af775d4,How long does it take to cook Panna Cotta in minutes?
9d2157b7-74ec-49d1-9f11-a5412af775d4,At what temperature should Panna Cotta be served?
9d2157b7-74ec-49d1-9f11-a5412af775d4,Does Panna Cotta require any cooking or is it a no-cook dessert?
6b6daa35-355c-4190-a420-e79b4908303e,What type of meat is used to make Sauerbraten?
6b6daa35-355c-4190-a420-e79b4908303e,How long does it take to cook Sauerbraten?
6b6daa35-355c-4190-a420-e79b4908303e,What is the main cooking method used for Sauerbraten?
6b6daa35-355c-4190-a420-e79b4908303e,Is Sauerbraten suitable for vegetarians?
6b6daa35-355c-4190-a420-e79b4908303e,What is used to thicken the sauce in Sauerbraten?
ede1db93-e4fb-4abb-8573-5dcc742e9be4,What is the primary ingredient used along with chickpeas in the Fatteh dish?
ede1db93-e4fb-4abb-8573-5dcc742e9be4,How long does it take to prepare the Fatteh meal?
ede1db93-e4fb-4abb-8573-5dcc742e9be4,Is Fatteh suitable for a vegetarian diet?
ede1db93-e4fb-4abb-8573-5dcc742e9be4,What is the recommended temperature for serving Fatteh?
ede1db93-e4fb-4abb-8573-5dcc742e9be4,What is the main step involved in preparing the Fatteh dish?
243c5b73-35db-4a36-a8fb-64fc9557738b,What are the main ingredients used to make Baba Ganoush?
243c5b73-35db-4a36-a8fb-64fc9557738b,How long does it take to cook Baba Ganoush?
243c5b73-35db-4a36-a8fb-64fc9557738b,What type of meal is Baba Ganoush typically considered?
243c5b73-35db-4a36-a8fb-64fc9557738b,Is Baba Ganoush suitable for a vegetarian diet?
243c5b73-35db-4a36-a8fb-64fc9557738b,What is the recommended temperature for serving Baba Ganoush?
940feb4d-c0f8-4489-816a-f04342567840,What type of meal is Plov and what is its spice level?
940feb4d-c0f8-4489-816a-f04342567840,How long does it take to cook Plov in minutes?
940feb4d-c0f8-4489-816a-f04342567840,Is Plov suitable for a vegetarian diet and what is the main cooking method used?
940feb4d-c0f8-4489-816a-f04342567840,At what temperature should Plov be served and is it a main course?
940feb4d-c0f8-4489-816a-f04342567840,What are the steps involved in making Plov and what ingredients are used in the process?
75a3ca95-5004-47ef-9f63-77243a861641,What are the primary ingredients used in this soup recipe?
75a3ca95-5004-47ef-9f63-77243a861641,How long does it take to prepare and cook this dish?
75a3ca95-5004-47ef-9f63-77243a861641,Is this soup suitable for individuals who follow a vegetarian diet?
75a3ca95-5004-47ef-9f63-77243a861641,What is the recommended serving temperature for the Leek and Potato Soup?
75a3ca95-5004-47ef-9f63-77243a861641,What is the main cooking method used to prepare this type of soup?
79134164-801c-41fd-8657-b25bd7262968,What type of protein is used in Katsudon?
79134164-801c-41fd-8657-b25bd7262968,Is Katsudon a suitable option for someone who follows a vegetarian diet?
79134164-801c-41fd-8657-b25bd7262968,What is the recommended temperature for serving Katsudon?
79134164-801c-41fd-8657-b25bd7262968,How long does it take to prepare Katsudon?
79134164-801c-41fd-8657-b25bd7262968,What is the primary cooking method used to make Katsudon?
96cc1ca3-31d5-4c98-99ad-dcc6569a2191,What is the main cooking method required to make Creme Brulee?
96cc1ca3-31d5-4c98-99ad-dcc6569a2191,Is Creme Brulee suitable for a vegetarian diet?
96cc1ca3-31d5-4c98-99ad-dcc6569a2191,How long does it take to cook Creme Brulee in total?
96cc1ca3-31d5-4c98-99ad-dcc6569a2191,At what temperature should Creme Brulee be served?
96cc1ca3-31d5-4c98-99ad-dcc6569a2191,What is the final step in making Creme Brulee after it has been chilled?
deff6867-031c-4085-a40e-b10cc897e449,What type of cooking method is required to make Beef Wellington?
deff6867-031c-4085-a40e-b10cc897e449,Is Beef Wellington suitable for vegetarians?
deff6867-031c-4085-a40e-b10cc897e449,What is the recommended serving temperature for Beef Wellington?
deff6867-031c-4085-a40e-b10cc897e449,How long does it take to cook Beef Wellington in minutes?
deff6867-031c-4085-a40e-b10cc897e449,What is the first step in preparing the beef fillet for Beef Wellington?
0af546e3-ef7f-4848-9d1d-b01f2c99553a,What type of meal is Biryani classified as?
0af546e3-ef7f-4848-9d1d-b01f2c99553a,How long does it take to cook Biryani in minutes?
0af546e3-ef7f-4848-9d1d-b01f2c99553a,Is Biryani suitable for a vegetarian diet?
0af546e3-ef7f-4848-9d1d-b01f2c99553a,At what temperature should Biryani be served?
0af546e3-ef7f-4848-9d1d-b01f2c99553a,What is the main method used to cook Biryani?
73c992d6-096e-473c-89aa-dee5df0e1581,What is the main cooking method used to prepare Gado-Gado?
73c992d6-096e-473c-89aa-dee5df0e1581,How long does it take to cook Gado-Gado?
73c992d6-096e-473c-89aa-dee5df0e1581,Is Gado-Gado suitable for vegetarians?
73c992d6-096e-473c-89aa-dee5df0e1581,At what temperature should Gado-Gado be served?
73c992d6-096e-473c-89aa-dee5df0e1581,What sauce is used in the preparation of Gado-Gado?
0543a0f9-6e6c-452b-92ff-96fc6eb9095d,What type of meal is Khachapuri classified as?
0543a0f9-6e6c-452b-92ff-96fc6eb9095d,How long does it take to cook Khachapuri in minutes?
0543a0f9-6e6c-452b-92ff-96fc6eb9095d,At what temperature should Khachapuri be served?
0543a0f9-6e6c-452b-92ff-96fc6eb9095d,Is Khachapuri suitable for a vegetarian diet?
0543a0f9-6e6c-452b-92ff-96fc6eb9095d,What is the primary method used to cook Khachapuri?
eefb3fc6-2c7f-4db7-906a-e597115fcd32,What are the main ingredients used to make Cottage Pie?
eefb3fc6-2c7f-4db7-906a-e597115fcd32,Is Cottage Pie suitable for vegetarians?
eefb3fc6-2c7f-4db7-906a-e597115fcd32,What is the recommended serving temperature for Cottage Pie?
eefb3fc6-2c7f-4db7-906a-e597115fcd32,How long does it take to cook Cottage Pie in total?
eefb3fc6-2c7f-4db7-906a-e597115fcd32,What cooking method is primarily used to make Cottage Pie?
63041fe0-7cd1-4146-bf62-cf0d171f6101,What are the main ingredients used to make Sweet and Sour Pork?
63041fe0-7cd1-4146-bf62-cf0d171f6101,Is Sweet and Sour Pork suitable for vegetarians?
63041fe0-7cd1-4146-bf62-cf0d171f6101,How long does it take to cook Sweet and Sour Pork?
63041fe0-7cd1-4146-bf62-cf0d171f6101,What is the recommended serving temperature for Sweet and Sour Pork?
63041fe0-7cd1-4146-bf62-cf0d171f6101,What cooking method is primarily used to prepare Sweet and Sour Pork?
8533a7bc-c0ba-4e1a-b0c1-2d53827e1000,What are the ingredients needed to make Vichyssoise?
8533a7bc-c0ba-4e1a-b0c1-2d53827e1000,How long does it take to cook Vichyssoise?
8533a7bc-c0ba-4e1a-b0c1-2d53827e1000,Is Vichyssoise suitable for vegetarians?
8533a7bc-c0ba-4e1a-b0c1-2d53827e1000,At what temperature should Vichyssoise be served?
8533a7bc-c0ba-4e1a-b0c1-2d53827e1000,What is the main cooking method used to prepare Vichyssoise?
d41f780b-8852-4577-8206-0dc7ae2ae6eb,What are the main ingredients used to make a Margherita Pizza
d41f780b-8852-4577-8206-0dc7ae2ae6eb,How long does it take to cook a Margherita Pizza
d41f780b-8852-4577-8206-0dc7ae2ae6eb,Is Margherita Pizza suitable for a vegetarian diet
d41f780b-8852-4577-8206-0dc7ae2ae6eb,What is the primary method of cooking a Margherita Pizza
d41f780b-8852-4577-8206-0dc7ae2ae6eb,At what temperature should a Margherita Pizza be served
58cb259f-502d-4bce-871b-d05d4ee6f754,What is the main ingredient that makes Spring Rolls non-vegetarian?
58cb259f-502d-4bce-871b-d05d4ee6f754,How long does it take to prepare Spring Rolls?
58cb259f-502d-4bce-871b-d05d4ee6f754,At what temperature should Spring Rolls be served?
58cb259f-502d-4bce-871b-d05d4ee6f754,What is the process of preparing the rice paper before filling it with ingredients?
58cb259f-502d-4bce-871b-d05d4ee6f754,What is the purpose of rolling the rice paper tightly in the preparation of Spring Rolls?
e1ec608b-1703-428c-9926-042a85569669,What type of flour is used to make a Galette?
e1ec608b-1703-428c-9926-042a85569669,Is Galette suitable for a vegetarian diet?
e1ec608b-1703-428c-9926-042a85569669,What is the recommended cooking time for a Galette?
e1ec608b-1703-428c-9926-042a85569669,How should a Galette be served?
e1ec608b-1703-428c-9926-042a85569669,What are the main ingredients used in a Galette?
58a6e96b-7154-4359-9e5d-1b5ccc77a19c,What type of meal is Sichuan Hotpot classified as?
58a6e96b-7154-4359-9e5d-1b5ccc77a19c,How long does it take to cook Sichuan Hotpot in total?
58a6e96b-7154-4359-9e5d-1b5ccc77a19c,Is Sichuan Hotpot suitable for a vegetarian diet?
58a6e96b-7154-4359-9e5d-1b5ccc77a19c,At what temperature is Sichuan Hotpot typically served?
58a6e96b-7154-4359-9e5d-1b5ccc77a19c,What is the primary method used to cook the ingredients in Sichuan Hotpot?
21ce0d0e-3b81-42cc-a9e3-6d381c2f63be,What type of meat is used to make Kitfo?
21ce0d0e-3b81-42cc-a9e3-6d381c2f63be,How long does it take to prepare Kitfo?
21ce0d0e-3b81-42cc-a9e3-6d381c2f63be,Is Kitfo suitable for vegetarians?
21ce0d0e-3b81-42cc-a9e3-6d381c2f63be,At what temperature is Kitfo typically served?
21ce0d0e-3b81-42cc-a9e3-6d381c2f63be,What is the primary method used to cook Kitfo?
50baa049-0f75-49e4-b3d7-39b5930f13e7,What type of flour is used to make Shiro and how long does it take to cook?
50baa049-0f75-49e4-b3d7-39b5930f13e7,Is Shiro a vegetarian dish and what is its spice level?
50baa049-0f75-49e4-b3d7-39b5930f13e7,What are the main ingredients used in making Shiro?
50baa049-0f75-49e4-b3d7-39b5930f13e7,How is the chickpea flour prepared before simmering and what is it served with?
50baa049-0f75-49e4-b3d7-39b5930f13e7,What is the recommended serving temperature and cooking method for Shiro?
6776f783-d9f3-469a-8d06-84bace454457,What type of meat is used in Tibs and how long does it take to cook it?
6776f783-d9f3-469a-8d06-84bace454457,Is Tibs a vegetarian dish and what is the main method of cooking used?
6776f783-d9f3-469a-8d06-84bace454457,What is the spice level of Tibs and how is the dish typically served?
6776f783-d9f3-469a-8d06-84bace454457,What are the main ingredients used in Tibs besides beef?
6776f783-d9f3-469a-8d06-84bace454457,How do I know when the beef in Tibs is cooked and what temperature should it be served at?
806c1304-2301-4e1f-bbcd-389dba7e4ded,What is the primary method of cooking used to prepare Fasolia?
806c1304-2301-4e1f-bbcd-389dba7e4ded,How long does it take to cook Fasolia in total?
806c1304-2301-4e1f-bbcd-389dba7e4ded,Is Fasolia suitable for individuals who follow a vegetarian diet?
806c1304-2301-4e1f-bbcd-389dba7e4ded,At what temperature is Fasolia typically served?
806c1304-2301-4e1f-bbcd-389dba7e4ded,What ingredients are used to make Fasolia and in what order are they cooked?
2859b7a1-2c94-44ec-b49b-6c1964153706,What type of flour is used to make Genfo?
2859b7a1-2c94-44ec-b49b-6c1964153706,Is Genfo suitable for a vegetarian diet?
2859b7a1-2c94-44ec-b49b-6c1964153706,How long does it take to cook Genfo?
2859b7a1-2c94-44ec-b49b-6c1964153706,At what temperature is Genfo typically served?
2859b7a1-2c94-44ec-b49b-6c1964153706,What is the spice level of Genfo?
0db53884-5777-454b-9b2d-185302fd055b,What ingredients do I need to make Gomen?
0db53884-5777-454b-9b2d-185302fd055b,How long does it take to cook Gomen?
0db53884-5777-454b-9b2d-185302fd055b,Is Gomen suitable for vegetarians?
0db53884-5777-454b-9b2d-185302fd055b,What is the main cooking method used to make Gomen?
0db53884-5777-454b-9b2d-185302fd055b,What is the recommended serving temperature for Gomen?
a344a344-7600-4de2-a3ad-0cbb120d141f,What is the main ingredient in Awaze Tibs besides the awaze paste?
a344a344-7600-4de2-a3ad-0cbb120d141f,What cooking method is used to prepare Awaze Tibs?
a344a344-7600-4de2-a3ad-0cbb120d141f,How long does it take to cook Awaze Tibs?
a344a344-7600-4de2-a3ad-0cbb120d141f,Is Awaze Tibs suitable for vegetarians?
a344a344-7600-4de2-a3ad-0cbb120d141f,At what temperature should Awaze Tibs be served?
3efb3a13-a975-4381-88b2-da35accf3b46,What is the main cooking method used to prepare Dulet?
3efb3a13-a975-4381-88b2-da35accf3b46,How long does it take to cook Dulet in minutes?
3efb3a13-a975-4381-88b2-da35accf3b46,Is Dulet suitable for a vegetarian diet?
3efb3a13-a975-4381-88b2-da35accf3b46,What is the required serving temperature for Dulet?
3efb3a13-a975-4381-88b2-da35accf3b46,What ingredients are used to make Dulet?
83c3ae67-366e-4801-b047-23d42ad01dcd,What type of meal is Chochos classified as?
83c3ae67-366e-4801-b047-23d42ad01dcd,How long does it take to cook Chochos in minutes?
83c3ae67-366e-4801-b047-23d42ad01dcd,Is Chochos suitable for a vegetarian diet?
83c3ae67-366e-4801-b047-23d42ad01dcd,What is the primary method used to cook Chochos?
83c3ae67-366e-4801-b047-23d42ad01dcd,At what temperature should Chochos be served?
c5d452e7-8c73-4569-bd48-a5a8a5e0cba1,What is the main ingredient used in making Ye'shimbra Assa!
c5d452e7-8c73-4569-bd48-a5a8a5e0cba1,How long does it take to cook Ye'shimbra Assa!
c5d452e7-8c73-4569-bd48-a5a8a5e0cba1,Is Ye'shimbra Assa suitable for vegetarians!
c5d452e7-8c73-4569-bd48-a5a8a5e0cba1,At what temperature should Ye'shimbra Assa be served!
c5d452e7-8c73-4569-bd48-a5a8a5e0cba1,What method is used for the main cooking of Ye'shimbra Assa!
e22de143-ba21-43d3-b98c-c362dc335adf,What are the main ingredients used to make Atayef?
e22de143-ba21-43d3-b98c-c362dc335adf,How long does it take to cook Atayef?
e22de143-ba21-43d3-b98c-c362dc335adf,What is the appropriate serving temperature for Atayef?
e22de143-ba21-43d3-b98c-c362dc335adf,Is Atayef suitable for a vegetarian diet?
e22de143-ba21-43d3-b98c-c362dc335adf,What are the steps to prepare and serve Atayef?
6ccd5648-f97d-4fba-b5bf-155d953f6609,What type of meal is Fish Curry considered to be?
6ccd5648-f97d-4fba-b5bf-155d953f6609,How long does it take to cook Fish Curry?
6ccd5648-f97d-4fba-b5bf-155d953f6609,Is Fish Curry suitable for vegetarians?
6ccd5648-f97d-4fba-b5bf-155d953f6609,What is the recommended serving temperature for Fish Curry?
6ccd5648-f97d-4fba-b5bf-155d953f6609,What is the main method used to cook Fish Curry?
54e75720-7e76-434c-95bf-d639ef7d290f,What is the main cooking method used to make Cornbread?
54e75720-7e76-434c-95bf-d639ef7d290f,Is Cornbread suitable for a vegetarian diet?
54e75720-7e76-434c-95bf-d639ef7d290f,How long does it take to cook Cornbread?
54e75720-7e76-434c-95bf-d639ef7d290f,What is the ideal serving temperature for Cornbread?
54e75720-7e76-434c-95bf-d639ef7d290f,What are the key ingredients required to make Cornbread?
4f147bad-7ace-4951-a05e-d4e8fb1f3ebd,What type of meal is Pumpkin Soup classified as?
4f147bad-7ace-4951-a05e-d4e8fb1f3ebd,How long does it take to cook Pumpkin Soup in minutes?
4f147bad-7ace-4951-a05e-d4e8fb1f3ebd,Is Pumpkin Soup suitable for a vegetarian diet?
4f147bad-7ace-4951-a05e-d4e8fb1f3ebd,What is the primary method used to cook Pumpkin Soup?
4f147bad-7ace-4951-a05e-d4e8fb1f3ebd,At what temperature should Pumpkin Soup be served?
ca879ff3-af94-4af0-85cb-99d9d2ed60e5,What are the key ingredients needed to make Shakshouka?
ca879ff3-af94-4af0-85cb-99d9d2ed60e5,Is Shakshouka a vegetarian meal and what is its spice level?
ca879ff3-af94-4af0-85cb-99d9d2ed60e5,What is the primary cooking method used to prepare Shakshouka and how long does it take?
ca879ff3-af94-4af0-85cb-99d9d2ed60e5,At what temperature should Shakshouka be served and what type of meal is it?
ca879ff3-af94-4af0-85cb-99d9d2ed60e5,What steps are involved in making Shakshouka from start to finish?
bfcdfe1e-e8dc-429b-aebc-f0571e2c79c2,What type of meal is Chole Bhature classified as?
bfcdfe1e-e8dc-429b-aebc-f0571e2c79c2,Are Chole Bhature suitable for a vegetarian diet?
bfcdfe1e-e8dc-429b-aebc-f0571e2c79c2,How long does it take to cook Chole Bhature in total?
bfcdfe1e-e8dc-429b-aebc-f0571e2c79c2,What is the recommended temperature for serving Chole Bhature?
bfcdfe1e-e8dc-429b-aebc-f0571e2c79c2,What is the primary method used to cook the chickpeas in Chole Bhature?
8276e8fd-3bc6-44ac-b6c6-ce78985c7099,What is the main cooking method used to prepare Stuffed Peppers?
8276e8fd-3bc6-44ac-b6c6-ce78985c7099,Are Stuffed Peppers suitable for a vegetarian diet?
8276e8fd-3bc6-44ac-b6c6-ce78985c7099,How long does it take to cook Stuffed Peppers?
8276e8fd-3bc6-44ac-b6c6-ce78985c7099,What is the recommended serving temperature for Stuffed Peppers?
8276e8fd-3bc6-44ac-b6c6-ce78985c7099,What ingredients are mixed together to fill the bell peppers?
bdc81b33-d0ea-4966-95bf-899a9f0f3b7a,What is the main ingredient in Pork Schnitzel
bdc81b33-d0ea-4966-95bf-899a9f0f3b7a,How long does it take to cook Pork Schnitzel in minutes
bdc81b33-d0ea-4966-95bf-899a9f0f3b7a,Is Pork Schnitzel a suitable meal for vegetarians
bdc81b33-d0ea-4966-95bf-899a9f0f3b7a,What is the recommended temperature for serving Pork Schnitzel
bdc81b33-d0ea-4966-95bf-899a9f0f3b7a,What are the steps to prepare the pork cutlets before frying them
b305c0d9-8fc3-42a2-a90f-bb5efd40667a,What type of meal is Pasta Primavera classified as?
b305c0d9-8fc3-42a2-a90f-bb5efd40667a,How long does it take to cook Pasta Primavera?
b305c0d9-8fc3-42a2-a90f-bb5efd40667a,Is Pasta Primavera suitable for vegetarians?
b305c0d9-8fc3-42a2-a90f-bb5efd40667a,What method is used to cook the pasta in Pasta Primavera?
b305c0d9-8fc3-42a2-a90f-bb5efd40667a,At what temperature should Pasta Primavera be served?
3474b734-9eef-4be0-ab9f-b3d53f6c39d7,What ingredients are required to make Pasta Puttanesca?
3474b734-9eef-4be0-ab9f-b3d53f6c39d7,How long does it take to cook Pasta Puttanesca?
3474b734-9eef-4be0-ab9f-b3d53f6c39d7,Is Pasta Puttanesca suitable for vegetarians?
3474b734-9eef-4be0-ab9f-b3d53f6c39d7,What is the main cooking method used for Pasta Puttanesca?
3474b734-9eef-4be0-ab9f-b3d53f6c39d7,What is the serving temperature for Pasta Puttanesca?
b2baa4ac-8611-4547-9643-62b1e54ceadc,What are the main ingredients used to make a Cobb Salad?
b2baa4ac-8611-4547-9643-62b1e54ceadc,How long does it take to prepare a Cobb Salad?
b2baa4ac-8611-4547-9643-62b1e54ceadc,Is the Cobb Salad suitable for vegetarians?
b2baa4ac-8611-4547-9643-62b1e54ceadc,What is the recommended serving temperature for a Cobb Salad?
