id,question
f2ff4980-fda2-4bfe-8a05-aca63be38345,What is the primary protein used in Doro Wat?
f2ff4980-fda2-4bfe-8a05-aca63be38345,How long does it take to prepare Doro Wat?
f2ff4980-fda2-4bfe-8a05-aca63be38345,What is the role of niter kibbeh in the recipe?
f2ff4980-fda2-4bfe-8a05-aca63be38345,Is Doro Wat suitable for a vegetarian diet?
f2ff4980-fda2-4bfe-8a05-aca63be38345,What is the recommended serving temperature for Doro Wat?
78c8ff6c-af26-4012-a637-af925fda17f7,What type of flour is used to make Injera?
78c8ff6c-af26-4012-a637-af925fda17f7,How long does the fermentation process take for Injera?
78c8ff6c-af26-4012-a637-af925fda17f7,What is the ideal serving temperature for Injera?
78c8ff6c-af26-4012-a637-af925fda17f7,Is Injera suitable for a vegetarian diet?
78c8ff6c-af26-4012-a637-af925fda17f7,What cooking method is used to cook Injera?
3437bb23-0c42-4548-9165-f31f586b968f,What are the main ingredients used to make Sushi?
3437bb23-0c42-4548-9165-f31f586b968f,How long does it take to prepare Sushi?
3437bb23-0c42-4548-9165-f31f586b968f,Is Sushi suitable for vegetarians?
3437bb23-0c42-4548-9165-f31f586b968f,At what temperature is Sushi typically served?
3437bb23-0c42-4548-9165-f31f586b968f,What is the primary method used for cooking Sushi?
ec101289-7120-4818-99ec-40345acf99b8,What type of meal is Tacos classified as?
ec101289-7120-4818-99ec-40345acf99b8,How long does it take to prepare Tacos?
ec101289-7120-4818-99ec-40345acf99b8,Is Tacos suitable for a vegetarian diet?
ec101289-7120-4818-99ec-40345acf99b8,What is the recommended temperature for serving Tacos?
ec101289-7120-4818-99ec-40345acf99b8,What method is used for cooking the main ingredient in Tacos?
8395a5cd-7bd2-45f7-a19d-c4a232d02fa4,What ingredients are needed to make Paella and in what order should they be added to the pan?
8395a5cd-7bd2-45f7-a19d-c4a232d02fa4,How long does it take to cook Paella and what is the recommended serving temperature?
8395a5cd-7bd2-45f7-a19d-c4a232d02fa4,Is Paella a suitable meal option for vegetarians and what is its spice level?
8395a5cd-7bd2-45f7-a19d-c4a232d02fa4,What is the main cooking method used to prepare Paella and what type of meal is it?
8395a5cd-7bd2-45f7-a19d-c4a232d02fa4,What is the last ingredient to be added when cooking Paella and how should the chicken be cooked initially?
b02851b7-0484-4d1a-b11e-68633b142bcf,What type of meal is Falafel considered to be?
b02851b7-0484-4d1a-b11e-68633b142bcf,How long does it take to cook Falafel in minutes?
b02851b7-0484-4d1a-b11e-68633b142bcf,Is Falafel suitable for people who follow a vegetarian diet?
b02851b7-0484-4d1a-b11e-68633b142bcf,What is the main method used to cook Falafel?
b02851b7-0484-4d1a-b11e-68633b142bcf,At what temperature is Falafel typically served?
9c9e38a1-3e19-4e5c-9342-f655b4fff98f,What are the ingredients required to make Pasta Carbonara?
9c9e38a1-3e19-4e5c-9342-f655b4fff98f,How long does it take to prepare Pasta Carbonara?
9c9e38a1-3e19-4e5c-9342-f655b4fff98f,Is Pasta Carbonara suitable for vegetarians?
9c9e38a1-3e19-4e5c-9342-f655b4fff98f,At what temperature should Pasta Carbonara be served?
9c9e38a1-3e19-4e5c-9342-f655b4fff98f,What is the primary method used to cook the pasta in Pasta Carbonara?
d7a9853a-337b-471b-8b12-bf86ab1322c0,What are the ingredients used in Tom Yum Soup?
d7a9853a-337b-471b-8b12-bf86ab1322c0,Is Tom Yum Soup suitable for vegetarians?
d7a9853a-337b-471b-8b12-bf86ab1322c0,How long does it take to cook Tom Yum Soup?
d7a9853a-337b-471b-8b12-bf86ab1322c0,What is the main cooking method used for Tom Yum Soup?
d7a9853a-337b-471b-8b12-bf86ab1322c0,What is the serving temperature of Tom Yum Soup?
f8c4457f-2dc0-441c-a89f-b2050f04fcbb,What are the ingredients required to make Chana Masala?
f8c4457f-2dc0-441c-a89f-b2050f04fcbb,How long does it take to cook Chana Masala?
f8c4457f-2dc0-441c-a89f-b2050f04fcbb,Is Chana Masala a suitable meal option for vegetarians?
f8c4457f-2dc0-441c-a89f-b2050f04fcbb,What is the spice level of Chana Masala?
f8c4457f-2dc0-441c-a89f-b2050f04fcbb,At what temperature should Chana Masala be served?
3648f997-4618-41ae-bac5-4a9da6e58540,What type of meal is Goulash classified as?
3648f997-4618-41ae-bac5-4a9da6e58540,How long does it take to cook Goulash in minutes?
3648f997-4618-41ae-bac5-4a9da6e58540,Is Goulash suitable for a vegetarian diet?
3648f997-4618-41ae-bac5-4a9da6e58540,What is the primary method used to cook Goulash?
3648f997-4618-41ae-bac5-4a9da6e58540,At what temperature should Goulash be served?
f6ad2867-bbf8-45b8-a6a5-327ca5da5b64,What are the main ingredients used to make Pad Thai?
f6ad2867-bbf8-45b8-a6a5-327ca5da5b64,How long does it take to cook Pad Thai?
f6ad2867-bbf8-45b8-a6a5-327ca5da5b64,What is the spice level of Pad Thai?
f6ad2867-bbf8-45b8-a6a5-327ca5da5b64,Can Pad Thai be served as a vegetarian meal?
f6ad2867-bbf8-45b8-a6a5-327ca5da5b64,What is the primary method of cooking used to prepare Pad Thai?
5300e5f7-9508-41c6-989a-ef8276776ecc,What type of meal is Ratatouille classified as?
5300e5f7-9508-41c6-989a-ef8276776ecc,Is Ratatouille suitable for vegetarian diets?
5300e5f7-9508-41c6-989a-ef8276776ecc,How long does it take to cook Ratatouille?
5300e5f7-9508-41c6-989a-ef8276776ecc,What is the primary method used to cook Ratatouille?
5300e5f7-9508-41c6-989a-ef8276776ecc,At what temperature is Ratatouille typically served?
168a43f2-0692-46ff-b219-2232bec7be1e,What is the main cooking method required to make Bibimbap?
168a43f2-0692-46ff-b219-2232bec7be1e,How long does it take to cook Bibimbap in total?
168a43f2-0692-46ff-b219-2232bec7be1e,Is Bibimbap suitable for vegetarians?
168a43f2-0692-46ff-b219-2232bec7be1e,What is the recommended serving temperature for Bibimbap?
168a43f2-0692-46ff-b219-2232bec7be1e,What type of meal is Bibimbap classified as?
0c872d0f-fd2c-45ff-9ba8-39a29306891f,What is the primary cooking method used to make Shakshuka?
0c872d0f-fd2c-45ff-9ba8-39a29306891f,Is Shakshuka suitable for a vegetarian diet?
0c872d0f-fd2c-45ff-9ba8-39a29306891f,How long does it take to cook Shakshuka?
0c872d0f-fd2c-45ff-9ba8-39a29306891f,At what temperature is Shakshuka typically served?
0c872d0f-fd2c-45ff-9ba8-39a29306891f,What is the spice level of the Shakshuka dish?
1c7876c7-05d5-46e0-a12a-1ef72b241012,What is the primary cooking method used to prepare Borscht?
1c7876c7-05d5-46e0-a12a-1ef72b241012,How long does it take to cook Borscht in total?
1c7876c7-05d5-46e0-a12a-1ef72b241012,Is Borscht suitable for a vegetarian diet?
1c7876c7-05d5-46e0-a12a-1ef72b241012,What is the recommended temperature for serving Borscht?
1c7876c7-05d5-46e0-a12a-1ef72b241012,Does Borscht have a high spice level?
7e1550ce-7bcd-44e5-90ee-54815b778bf6,What ingredients are used to marinate the chicken in the Chicken Tikka Masala recipe?
7e1550ce-7bcd-44e5-90ee-54815b778bf6,How long does it take to cook the Chicken Tikka Masala dish?
7e1550ce-7bcd-44e5-90ee-54815b778bf6,What is the main cooking method used to prepare the Chicken Tikka Masala?
7e1550ce-7bcd-44e5-90ee-54815b778bf6,Is the Chicken Tikka Masala suitable for vegetarians?
7e1550ce-7bcd-44e5-90ee-54815b778bf6,At what temperature should the Chicken Tikka Masala be served?
d7906804-5b58-446b-9055-bb9b22a9259e,What are the main ingredients used to make Pho?
d7906804-5b58-446b-9055-bb9b22a9259e,How long does it take to cook Pho in total?
d7906804-5b58-446b-9055-bb9b22a9259e,Is Pho suitable for vegetarians to eat?
d7906804-5b58-446b-9055-bb9b22a9259e,What is the recommended temperature to serve Pho at?
d7906804-5b58-446b-9055-bb9b22a9259e,What is the level of spiciness in a traditional Pho dish?
b6e4194e-f5a2-44ef-a252-28ef29f0b7c2,What is the main ingredient in Hummus?
b6e4194e-f5a2-44ef-a252-28ef29f0b7c2,How long does it take to prepare Hummus?
b6e4194e-f5a2-44ef-a252-28ef29f0b7c2,Is Hummus suitable for a vegetarian diet?
b6e4194e-f5a2-44ef-a252-28ef29f0b7c2,What is the recommended serving temperature for Hummus?
b6e4194e-f5a2-44ef-a252-28ef29f0b7c2,Does Hummus require any cooking?
dec77a93-693a-4d4f-b441-7364addcf704,What type of meal is Empanadas classified as?
dec77a93-693a-4d4f-b441-7364addcf704,How long does it take to cook Empanadas in total?
dec77a93-693a-4d4f-b441-7364addcf704,Is Empanadas suitable for a vegetarian diet?
dec77a93-693a-4d4f-b441-7364addcf704,At what temperature should Empanadas be served?
dec77a93-693a-4d4f-b441-7364addcf704,What is the main method used to cook Empanadas?
9cf17372-7e6a-4005-b55b-541ea28b2e80,What are the main ingredients used to make Ramen?
9cf17372-7e6a-4005-b55b-541ea28b2e80,How long does it take to cook Ramen in total?
9cf17372-7e6a-4005-b55b-541ea28b2e80,Is Ramen suitable for a vegetarian diet?
9cf17372-7e6a-4005-b55b-541ea28b2e80,What is the preferred serving temperature for Ramen?
9cf17372-7e6a-4005-b55b-541ea28b2e80,What is the primary method of cooking the noodles in Ramen?
cd3b02f3-bff7-4e37-a1e9-e4e63e65f226,What are the main ingredients needed to make Ceviche?
cd3b02f3-bff7-4e37-a1e9-e4e63e65f226,Is Ceviche suitable for someone who prefers mild spices?
cd3b02f3-bff7-4e37-a1e9-e4e63e65f226,How long does it take to prepare Ceviche?
cd3b02f3-bff7-4e37-a1e9-e4e63e65f226,Is Ceviche typically served hot or cold?
cd3b02f3-bff7-4e37-a1e9-e4e63e65f226,Does the preparation of Ceviche require any cooking?
872008b9-3eea-455e-9b13-bb2a891f29ee,What type of meal is Tandoori Chicken considered and what is its main cooking method?
872008b9-3eea-455e-9b13-bb2a891f29ee,How long does it take to cook Tandoori Chicken and at what temperature is it served?
872008b9-3eea-455e-9b13-bb2a891f29ee,Is Tandoori Chicken suitable for vegetarians and what is its spice level?
872008b9-3eea-455e-9b13-bb2a891f29ee,What ingredients are required to make Tandoori Chicken and how are they used?
872008b9-3eea-455e-9b13-bb2a891f29ee,What are the steps involved in making Tandoori Chicken and what is the desired final texture of the chicken?
1ef44fc6-10d1-4e08-a67e-bcd75aeb1195,What are the primary ingredients used to make Pierogi?
1ef44fc6-10d1-4e08-a67e-bcd75aeb1195,How long does it take to cook Pierogi in total?
1ef44fc6-10d1-4e08-a67e-bcd75aeb1195,Is Pierogi suitable for a vegetarian diet and what is its spice level?
1ef44fc6-10d1-4e08-a67e-bcd75aeb1195,What is the main cooking method used to prepare Pierogi?
1ef44fc6-10d1-4e08-a67e-bcd75aeb1195,At what temperature should Pierogi be served after cooking?
7b4dac6e-04bc-4c9e-8766-c402cd1ea8c2,What are the ingredients required to make Peking Duck?
7b4dac6e-04bc-4c9e-8766-c402cd1ea8c2,Is Peking Duck suitable for a vegetarian diet?
7b4dac6e-04bc-4c9e-8766-c402cd1ea8c2,What is the recommended cooking method for preparing Peking Duck?
7b4dac6e-04bc-4c9e-8766-c402cd1ea8c2,How long does it take to cook Peking Duck?
7b4dac6e-04bc-4c9e-8766-c402cd1ea8c2,What is the appropriate temperature for serving Peking Duck?
985d733d-de81-46cd-8c5c-db9dc5f3d9c8,What type of meal is Tiramisu classified as?
985d733d-de81-46cd-8c5c-db9dc5f3d9c8,How long does it take to prepare Tiramisu in minutes?
985d733d-de81-46cd-8c5c-db9dc5f3d9c8,Is Tiramisu suitable for a vegetarian diet?
985d733d-de81-46cd-8c5c-db9dc5f3d9c8,What is the primary method used to make Tiramisu?
985d733d-de81-46cd-8c5c-db9dc5f3d9c8,At what temperature is Tiramisu typically served?
e273c335-e941-4619-a7d9-6f29f25d76bf,What type of meal is Gumbo and what is its spice level?
e273c335-e941-4619-a7d9-6f29f25d76bf,How long does it take to cook Gumbo and what is the main cooking method used?
e273c335-e941-4619-a7d9-6f29f25d76bf,Is Gumbo a vegetarian dish and what is the serving temperature?
e273c335-e941-4619-a7d9-6f29f25d76bf,What are the main ingredients used to make Gumbo and how are they prepared?
e273c335-e941-4619-a7d9-6f29f25d76bf,What is the final texture of Gumbo after simmering with spices and what temperature is it served at?
e3bf7935-d6f5-40d6-9073-c868f978b9db,What type of protein is used in Fajitas and how long does it take to cook?
e3bf7935-d6f5-40d6-9073-c868f978b9db,Are Fajitas suitable for a vegetarian diet and why?
e3bf7935-d6f5-40d6-9073-c868f978b9db,What is the recommended serving temperature for Fajitas?
e3bf7935-d6f5-40d6-9073-c868f978b9db,What method is used to cook the beef and vegetables in Fajitas?
e3bf7935-d6f5-40d6-9073-c868f978b9db,Does the spice level of Fajitas make it unsuitable for sensitive palates?
86d86269-348d-4fd4-8004-56ac515e6206,What type of meal is Moussaka and what is its spice level?
86d86269-348d-4fd4-8004-56ac515e6206,How long does it take to cook Moussaka and what is the main cooking method used?
86d86269-348d-4fd4-8004-56ac515e6206,Is Moussaka suitable for vegetarians and what is the serving temperature?
86d86269-348d-4fd4-8004-56ac515e6206,What are the key ingredients needed to make Moussaka?
86d86269-348d-4fd4-8004-56ac515e6206,What is the step-by-step process to make Moussaka including the preparation of the eggplant?
ea358665-bc26-4fdf-adce-9a49ce60541f,What type of noodles are used in Laksa and how are they cooked
ea358665-bc26-4fdf-adce-9a49ce60541f,Is Laksa suitable for a vegetarian diet
ea358665-bc26-4fdf-adce-9a49ce60541f,How long does it take to cook Laksa and what is the main cooking method used
ea358665-bc26-4fdf-adce-9a49ce60541f,What is the spice level of Laksa and how is the soup base prepared
ea358665-bc26-4fdf-adce-9a49ce60541f,At what temperature should Laksa be served and what garnish is recommended
04e275d0-865d-4941-8b72-82c7ee8092dd,What type of meal is Baklava classified as?
04e275d0-865d-4941-8b72-82c7ee8092dd,How long does it take to cook Baklava in minutes?
04e275d0-865d-4941-8b72-82c7ee8092dd,Is Baklava suitable for a vegetarian diet?
04e275d0-865d-4941-8b72-82c7ee8092dd,What is the primary method used to cook Baklava?
04e275d0-865d-4941-8b72-82c7ee8092dd,At what temperature should Baklava be served?
20e83e6c-e356-4884-b2f8-9db158c175c4,What type of noodles are used in the Pho Ga recipe?
20e83e6c-e356-4884-b2f8-9db158c175c4,How long does it take to cook the Pho Ga dish?
20e83e6c-e356-4884-b2f8-9db158c175c4,Is Pho Ga suitable for a vegetarian diet?
20e83e6c-e356-4884-b2f8-9db158c175c4,What is the recommended serving temperature for Pho Ga?
20e83e6c-e356-4884-b2f8-9db158c175c4,What is the main method used to cook the chicken in the Pho Ga recipe?
a3300c34-28b5-48c9-be24-3cad68e29b49,What are the key ingredients needed to make Roti Canai?
a3300c34-28b5-48c9-be24-3cad68e29b49,Is Roti Canai a suitable option for a vegetarian meal?
a3300c34-28b5-48c9-be24-3cad68e29b49,What is the primary method used to cook Roti Canai?
a3300c34-28b5-48c9-be24-3cad68e29b49,How long does it take to prepare and cook Roti Canai?
a3300c34-28b5-48c9-be24-3cad68e29b49,At what temperature should Roti Canai be served to ensure optimal flavor and texture?
e8d90b0c-cc32-4f10-9a7a-c3af3bac39ca,What type of meal is Clam Chowder and what is its spice level?
e8d90b0c-cc32-4f10-9a7a-c3af3bac39ca,How long does it take to cook Clam Chowder and at what temperature is it served?
e8d90b0c-cc32-4f10-9a7a-c3af3bac39ca,Is Clam Chowder suitable for vegetarians and what is the main cooking method used?
e8d90b0c-cc32-4f10-9a7a-c3af3bac39ca,What ingredients are used to make Clam Chowder and how are they prepared?
e8d90b0c-cc32-4f10-9a7a-c3af3bac39ca,What is the first step in making Clam Chowder and what happens to the mixture as it cooks?
5435a146-92b5-4229-816d-b58ded66553e,What is the primary ingredient used to make the dough for Samosa?
5435a146-92b5-4229-816d-b58ded66553e,How long does it take to cook Samosa?
5435a146-92b5-4229-816d-b58ded66553e,Is Samosa suitable for a vegetarian diet?
5435a146-92b5-4229-816d-b58ded66553e,What is the ideal temperature to serve Samosa?
5435a146-92b5-4229-816d-b58ded66553e,What is the main cooking method used to prepare Samosa?
8ee45bd0-c7b2-4e30-9d9b-f85af3098d64,What type of meal is Pavlova considered?
8ee45bd0-c7b2-4e30-9d9b-f85af3098d64,How long does it take to prepare Pavlova?
8ee45bd0-c7b2-4e30-9d9b-f85af3098d64,Is Pavlova suitable for vegetarians?
8ee45bd0-c7b2-4e30-9d9b-f85af3098d64,At what temperature should Pavlova be served?
8ee45bd0-c7b2-4e30-9d9b-f85af3098d64,What is the main method used to cook Pavlova?
69466dcf-b501-4969-8c08-8cd1e12ee6f9,What are the key ingredients required to make Miso Soup?
69466dcf-b501-4969-8c08-8cd1e12ee6f9,How long does it take to cook Miso Soup in total?
69466dcf-b501-4969-8c08-8cd1e12ee6f9,Is Miso Soup suitable for individuals who follow a vegetarian diet?
69466dcf-b501-4969-8c08-8cd1e12ee6f9,What is the recommended temperature for serving Miso Soup?
69466dcf-b501-4969-8c08-8cd1e12ee6f9,What is the primary method used to cook Miso Soup?
66b09175-86f0-45e7-8cbc-bcd0270611fd,What type of meal is Koofteh Tabrizi considered and what is its spice level?
66b09175-86f0-45e7-8cbc-bcd0270611fd,How long does it take to cook Koofteh Tabrizi and at what temperature is it served?
66b09175-86f0-45e7-8cbc-bcd0270611fd,What are the main ingredients used to make Koofteh Tabrizi and is it suitable for vegetarians?
66b09175-86f0-45e7-8cbc-bcd0270611fd,What is the primary method of cooking Koofteh Tabrizi and how are the ingredients prepared?
66b09175-86f0-45e7-8cbc-bcd0270611fd,What is the process of forming and cooking Koofteh Tabrizi after mixing the ingredients?
e558db7d-edad-48b9-a67d-54deb7ea2be1,What are the ingredients needed to make Fish and Chips?
e558db7d-edad-48b9-a67d-54deb7ea2be1,How long does it take to prepare and cook Fish and Chips?
e558db7d-edad-48b9-a67d-54deb7ea2be1,What is the primary cooking method used for Fish and Chips?
e558db7d-edad-48b9-a67d-54deb7ea2be1,Is Fish and Chips a suitable option for vegetarians?
e558db7d-edad-48b9-a67d-54deb7ea2be1,What temperature should Fish and Chips be served at?
d9ab1967-6171-4587-9624-e4a6247ff1e3,What type of meal is Fettuccine Alfredo considered to be?
d9ab1967-6171-4587-9624-e4a6247ff1e3,How long does it take to cook Fettuccine Alfredo in total?
d9ab1967-6171-4587-9624-e4a6247ff1e3,Is Fettuccine Alfredo suitable for individuals who follow a vegetarian diet?
d9ab1967-6171-4587-9624-e4a6247ff1e3,At what temperature is Fettuccine Alfredo typically served?
d9ab1967-6171-4587-9624-e4a6247ff1e3,What is the primary method used for cooking the pasta in Fettuccine Alfredo?
ff2895f4-6df2-450b-b16f-ae9a8f0e8b8d,What are the key ingredients needed to make Gazpacho?
ff2895f4-6df2-450b-b16f-ae9a8f0e8b8d,Is Gazpacho suitable for vegetarians and what is the main cooking method used?
ff2895f4-6df2-450b-b16f-ae9a8f0e8b8d,How long does it take to prepare Gazpacho and at what temperature is it served?
ff2895f4-6df2-450b-b16f-ae9a8f0e8b8d,What is the spice level of Gazpacho and how is it typically served?
ff2895f4-6df2-450b-b16f-ae9a8f0e8b8d,What is the step-by-step process to make Gazpacho according to the provided instructions?
7de1bf55-a37e-4b1c-8f5e-4304b1f56cd4,What type of meat is used in the Bulgogi recipe?
7de1bf55-a37e-4b1c-8f5e-4304b1f56cd4,How long does it take to cook Bulgogi?
7de1bf55-a37e-4b1c-8f5e-4304b1f56cd4,What is the primary method of cooking Bulgogi?
7de1bf55-a37e-4b1c-8f5e-4304b1f56cd4,Is Bulgogi suitable for a vegetarian diet?
7de1bf55-a37e-4b1c-8f5e-4304b1f56cd4,At what temperature is Bulgogi typically served?
e718a412-3f08-4514-8dfc-05b22cfa24a2,What ingredients are needed to make Pierogies?
e718a412-3f08-4514-8dfc-05b22cfa24a2,How long does it take to cook Pierogies?
e718a412-3f08-4514-8dfc-05b22cfa24a2,Are Pierogies suitable for a vegetarian diet?
e718a412-3f08-4514-8dfc-05b22cfa24a2,What is the main cooking method used to prepare Pierogies?
e718a412-3f08-4514-8dfc-05b22cfa24a2,At what temperature should Pierogies be served?
d69296f1-90b2-4c19-986c-5a67d1064f15,What type of ingredients are required to make Bouillabaisse?
d69296f1-90b2-4c19-986c-5a67d1064f15,How long does it take to cook Bouillabaisse in total?
d69296f1-90b2-4c19-986c-5a67d1064f15,Is Bouillabaisse suitable for a vegetarian diet?
d69296f1-90b2-4c19-986c-5a67d1064f15,What is the main method used to cook Bouillabaisse?
d69296f1-90b2-4c19-986c-5a67d1064f15,At what temperature should Bouillabaisse be served?
f5ba6df8-bbf4-4eae-8f20-95ce3bcf6aad,What type of meal is Spaghetti Bolognese classified as?
f5ba6df8-bbf4-4eae-8f20-95ce3bcf6aad,How long does it take to cook Spaghetti Bolognese in total?
f5ba6df8-bbf4-4eae-8f20-95ce3bcf6aad,Is Spaghetti Bolognese suitable for vegetarians?
f5ba6df8-bbf4-4eae-8f20-95ce3bcf6aad,What is the recommended serving temperature for Spaghetti Bolognese?
f5ba6df8-bbf4-4eae-8f20-95ce3bcf6aad,What is the primary method used to cook the spaghetti in Spaghetti Bolognese?
cb02d899-7111-45c1-b6e1-d84844af466c,What are the ingredients required to make Chicken Parmesan?
cb02d899-7111-45c1-b6e1-d84844af466c,How long does it take to cook Chicken Parmesan?
cb02d899-7111-45c1-b6e1-d84844af466c,Is Chicken Parmesan a suitable option for vegetarians?
cb02d899-7111-45c1-b6e1-d84844af466c,What is the primary method of cooking used in Chicken Parmesan?
cb02d899-7111-45c1-b6e1-d84844af466c,At what temperature is Chicken Parmesan typically served?
ec92e848-d68b-4fdb-943b-9f69cb88a396,What type of meal is Pho Bo classified as?
ec92e848-d68b-4fdb-943b-9f69cb88a396,How long does it take to cook Pho Bo in minutes?
ec92e848-d68b-4fdb-943b-9f69cb88a396,Is Pho Bo suitable for a vegetarian diet?
ec92e848-d68b-4fdb-943b-9f69cb88a396,What is the recommended serving temperature for Pho Bo?
ec92e848-d68b-4fdb-943b-9f69cb88a396,What is the main method used to cook Pho Bo?
44a1a157-5e92-4d48-af04-998a7598d47b,What are the primary ingredients required to make Eggplant Parmesan?
44a1a157-5e92-4d48-af04-998a7598d47b,Is Eggplant Parmesan a vegetarian dish and what is its spice level?
44a1a157-5e92-4d48-af04-998a7598d47b,What is the main cooking method used to prepare Eggplant Parmesan?
44a1a157-5e92-4d48-af04-998a7598d47b,How long does it take to cook Eggplant Parmesan and at what temperature is it served?
44a1a157-5e92-4d48-af04-998a7598d47b,"What are the steps involved in making Eggplant Parmesan, including any frying or baking?"
5c92395a-f03f-4192-8376-aefddcc9d7cf,What are the main ingredients used to prepare Jollof Rice
5c92395a-f03f-4192-8376-aefddcc9d7cf,Is Jollof Rice suitable for vegetarians
5c92395a-f03f-4192-8376-aefddcc9d7cf,What is the recommended serving temperature for Jollof Rice
5c92395a-f03f-4192-8376-aefddcc9d7cf,How long does it take to cook Jollof Rice
5c92395a-f03f-4192-8376-aefddcc9d7cf,What is the primary method used to cook Jollof Rice
37b1f6a3-93ec-4a6b-951a-14ac6c0c5641,What type of meat is used in Shabu Shabu and how is it prepared?
37b1f6a3-93ec-4a6b-951a-14ac6c0c5641,Is Shabu Shabu suitable for a vegetarian diet?
37b1f6a3-93ec-4a6b-951a-14ac6c0c5641,What is the recommended cooking time for Shabu Shabu in minutes?
37b1f6a3-93ec-4a6b-951a-14ac6c0c5641,How should the broth be prepared for Shabu Shabu?
37b1f6a3-93ec-4a6b-951a-14ac6c0c5641,What is the ideal temperature for serving Shabu Shabu?
3538b054-db93-40b5-9d76-9d804e7e81ff,What is the primary cooking method used to prepare Gnocchi?
3538b054-db93-40b5-9d76-9d804e7e81ff,Are Gnocchi suitable for a vegetarian diet?
3538b054-db93-40b5-9d76-9d804e7e81ff,How long does it take to cook Gnocchi?
3538b054-db93-40b5-9d76-9d804e7e81ff,What is the recommended serving temperature for Gnocchi?
3538b054-db93-40b5-9d76-9d804e7e81ff,What ingredients are typically served with Gnocchi when it's done?
04e6cd7e-de6b-40c6-9494-ac03d4a53d0a,What is the spice level of the Chow Mein dish?
04e6cd7e-de6b-40c6-9494-ac03d4a53d0a,How long does it take to prepare the Chow Mein?
04e6cd7e-de6b-40c6-9494-ac03d4a53d0a,Is the Chow Mein suitable for vegetarians?
04e6cd7e-de6b-40c6-9494-ac03d4a53d0a,What is the recommended serving temperature for the Chow Mein?
04e6cd7e-de6b-40c6-9494-ac03d4a53d0a,What is the main cooking method used to make the Chow Mein?
0df262cb-848d-4ae9-a5fd-52cdeb08505e,What type of meal is Coq au Vin classified as?
0df262cb-848d-4ae9-a5fd-52cdeb08505e,How long does it take to prepare Coq au Vin in minutes?
0df262cb-848d-4ae9-a5fd-52cdeb08505e,Is Coq au Vin suitable for a vegetarian diet?
0df262cb-848d-4ae9-a5fd-52cdeb08505e,What is the primary cooking method used to make Coq au Vin?
0df262cb-848d-4ae9-a5fd-52cdeb08505e,At what temperature should Coq au Vin be served?
aaaaa164-bf46-424e-b1be-55f1c1b0d670,What are the ingredients needed to make Poutine?
aaaaa164-bf46-424e-b1be-55f1c1b0d670,How long does it take to cook Poutine?
aaaaa164-bf46-424e-b1be-55f1c1b0d670,Is Poutine suitable for a vegetarian diet?
aaaaa164-bf46-424e-b1be-55f1c1b0d670,What is the main method used to cook Poutine?
aaaaa164-bf46-424e-b1be-55f1c1b0d670,What is the recommended temperature for serving Poutine?
5d8bfe87-011a-42ba-90e1-95d97188ab85,What type of meal is Bruschetta classified as?
5d8bfe87-011a-42ba-90e1-95d97188ab85,How long does it take to prepare Bruschetta in minutes?
5d8bfe87-011a-42ba-90e1-95d97188ab85,Is Bruschetta suitable for individuals who follow a vegetarian diet?
5d8bfe87-011a-42ba-90e1-95d97188ab85,At what temperature should Bruschetta be served?
5d8bfe87-011a-42ba-90e1-95d97188ab85,What is the primary method used to cook Bruschetta?
4c7d274a-9d20-4d2b-8237-380900a1dc66,What type of dish is Chicken Vindaloo and what meal type does it belong to?
4c7d274a-9d20-4d2b-8237-380900a1dc66,How long does it take to cook Chicken Vindaloo in minutes?
4c7d274a-9d20-4d2b-8237-380900a1dc66,Is Chicken Vindaloo suitable for a vegetarian diet?
4c7d274a-9d20-4d2b-8237-380900a1dc66,What is the recommended temperature for serving Chicken Vindaloo?
4c7d274a-9d20-4d2b-8237-380900a1dc66,What are the main steps involved in making Chicken Vindaloo?
1854a837-c766-4823-9e32-bc64f73a1710,What type of meal is Mole Poblano and what is its spice level?
1854a837-c766-4823-9e32-bc64f73a1710,How long does it take to cook Mole Poblano in total?
1854a837-c766-4823-9e32-bc64f73a1710,Is Mole Poblano suitable for a vegetarian diet?
