id,question
b2baa4ac-8611-4547-9643-62b1e54ceadc,What are the steps involved in making a Cobb Salad?
3ffa7d83-988e-45d6-a266-1dc469dc20dd,What are the primary ingredients required to make Chicken Shawarma?
3ffa7d83-988e-45d6-a266-1dc469dc20dd,How long does it take to prepare and cook Chicken Shawarma?
3ffa7d83-988e-45d6-a266-1dc469dc20dd,Is Chicken Shawarma suitable for individuals who follow a vegetarian diet?
3ffa7d83-988e-45d6-a266-1dc469dc20dd,What is the recommended internal temperature or serving style for Chicken Shawarma?
3ffa7d83-988e-45d6-a266-1dc469dc20dd,What is the main cooking method used to prepare the chicken in Chicken Shawarma?
004cc2ac-a391-4e74-9e8b-bfed96e66dbf,What is the primary ingredient in Kibbeh besides the ground meat?
004cc2ac-a391-4e74-9e8b-bfed96e66dbf,How long does it take to cook Kibbeh in total?
004cc2ac-a391-4e74-9e8b-bfed96e66dbf,Is Kibbeh suitable for someone who follows a vegetarian diet?
004cc2ac-a391-4e74-9e8b-bfed96e66dbf,Can Kibbeh be cooked using methods other than baking?
004cc2ac-a391-4e74-9e8b-bfed96e66dbf,At what temperature is Kibbeh typically served?
dbcb585d-c83f-4b93-b925-9b8e641ded80,What type of protein is used in the Fesenjan dish?
dbcb585d-c83f-4b93-b925-9b8e641ded80,How long does it take to cook the Fesenjan meal?
dbcb585d-c83f-4b93-b925-9b8e641ded80,Is the Fesenjan meal suitable for vegetarians?
dbcb585d-c83f-4b93-b925-9b8e641ded80,What is the recommended serving temperature for Fesenjan?
dbcb585d-c83f-4b93-b925-9b8e641ded80,What cooking method is primarily used to prepare the Fesenjan dish?
033d2093-952e-4b56-a11b-e990344ccefe,What type of protein is used in Galbi and how long does it take to cook?
033d2093-952e-4b56-a11b-e990344ccefe,Is Galbi suitable for vegetarians and what is the primary cooking method?
033d2093-952e-4b56-a11b-e990344ccefe,What is the spice level of Galbi and at what temperature is it served?
033d2093-952e-4b56-a11b-e990344ccefe,What ingredients are used to marinate the short ribs in Galbi and how are they cooked?
033d2093-952e-4b56-a11b-e990344ccefe,How would you describe the texture and appearance of Galbi after it has been grilled?
0955da9a-0e42-4bf8-8b78-4e1e1ca0174a,"What type of meal is Pav Bhaji, and is it suitable for vegetarians?"
0955da9a-0e42-4bf8-8b78-4e1e1ca0174a,"How long does it take to cook Pav Bhaji, and what is the recommended serving temperature?"
0955da9a-0e42-4bf8-8b78-4e1e1ca0174a,"What ingredients are used to make Pav Bhaji, and how are they prepared?"
0955da9a-0e42-4bf8-8b78-4e1e1ca0174a,"What is the spice level of Pav Bhaji, and what method is used for main cooking?"
0955da9a-0e42-4bf8-8b78-4e1e1ca0174a,"How should Pav Bhaji be served, and what is typically served with it?"
75c6c34a-0e6d-43e2-a676-33c66e4d41c3,What type of cookware is recommended to prepare Okonomiyaki
75c6c34a-0e6d-43e2-a676-33c66e4d41c3,How long does it take to cook Okonomiyaki from start to finish
75c6c34a-0e6d-43e2-a676-33c66e4d41c3,Is Okonomiyaki suitable for someone who follows a vegetarian diet
75c6c34a-0e6d-43e2-a676-33c66e4d41c3,At what temperature should Okonomiyaki be served to the guests
75c6c34a-0e6d-43e2-a676-33c66e4d41c3,What is the primary method used for cooking Okonomiyaki
33a7c0eb-4449-4f19-b727-655177a62ee2,What type of protein is used in the Rendang dish?
33a7c0eb-4449-4f19-b727-655177a62ee2,How long does it take to cook the Rendang meal?
33a7c0eb-4449-4f19-b727-655177a62ee2,Is the Rendang meal suitable for a vegetarian diet?
33a7c0eb-4449-4f19-b727-655177a62ee2,What is the recommended serving temperature for the Rendang?
33a7c0eb-4449-4f19-b727-655177a62ee2,What is the primary cooking method used to prepare the Rendang?
56caf6c1-5ba5-45d8-93c8-f7a44d1738c5,What type of meal is Boeuf Bourguignon and what is its spice level?
56caf6c1-5ba5-45d8-93c8-f7a44d1738c5,How long does it take to cook Boeuf Bourguignon in minutes?
56caf6c1-5ba5-45d8-93c8-f7a44d1738c5,Is Boeuf Bourguignon suitable for vegetarians and what is the main cooking method used?
56caf6c1-5ba5-45d8-93c8-f7a44d1738c5,At what temperature should Boeuf Bourguignon be served and what are the key ingredients?
56caf6c1-5ba5-45d8-93c8-f7a44d1738c5,What are the steps to make Boeuf Bourguignon and what is the resulting texture of the beef?
705868ac-8a88-4ef9-abfd-140136d9fe7e,What type of meal is Himbasha classified as?
705868ac-8a88-4ef9-abfd-140136d9fe7e,How long does it take to cook Himbasha in minutes?
705868ac-8a88-4ef9-abfd-140136d9fe7e,Is Himbasha suitable for a vegetarian diet?
705868ac-8a88-4ef9-abfd-140136d9fe7e,What is the primary method used to cook Himbasha?
705868ac-8a88-4ef9-abfd-140136d9fe7e,At what temperature should Himbasha be served?
b943250f-8878-455a-a4cc-6788103afcf3,What type of flour is used in Bozena Shiro's recipe?
b943250f-8878-455a-a4cc-6788103afcf3,Is Bozena Shiro's dish suitable for vegetarians?
b943250f-8878-455a-a4cc-6788103afcf3,What is the recommended serving temperature for this meal?
b943250f-8878-455a-a4cc-6788103afcf3,How long does it take to prepare Bozena Shiro's dish?
b943250f-8878-455a-a4cc-6788103afcf3,What is the primary cooking method used in this recipe?
6b418c45-aeb6-4eb0-b8fb-c38baa4a57fb,What ingredients are required to make Fried Plantains?
6b418c45-aeb6-4eb0-b8fb-c38baa4a57fb,How long does it take to cook Fried Plantains?
6b418c45-aeb6-4eb0-b8fb-c38baa4a57fb,Is Fried Plantains suitable for a vegetarian diet?
6b418c45-aeb6-4eb0-b8fb-c38baa4a57fb,At what temperature should Fried Plantains be served?
6b418c45-aeb6-4eb0-b8fb-c38baa4a57fb,What is the main method used to cook Fried Plantains?
15be7b9f-3d94-4bc0-8386-b9d4ea93770d,What type of meal is Chimichanga classified as?
15be7b9f-3d94-4bc0-8386-b9d4ea93770d,How long does it take to cook a Chimichanga?
15be7b9f-3d94-4bc0-8386-b9d4ea93770d,Is Chimichanga suitable for vegetarians?
15be7b9f-3d94-4bc0-8386-b9d4ea93770d,What is the recommended serving temperature for a Chimichanga?
15be7b9f-3d94-4bc0-8386-b9d4ea93770d,What is the primary method used to cook a Chimichanga?
3bbfda41-8645-482e-9cfa-928e18e9275e,What type of meal is Mango Sticky Rice considered to be?
3bbfda41-8645-482e-9cfa-928e18e9275e,How long does it take to prepare Mango Sticky Rice?
3bbfda41-8645-482e-9cfa-928e18e9275e,Is Mango Sticky Rice suitable for vegetarians?
3bbfda41-8645-482e-9cfa-928e18e9275e,At what temperature should Mango Sticky Rice be served?
3bbfda41-8645-482e-9cfa-928e18e9275e,What is the primary method used to cook the rice in Mango Sticky Rice?
70d3cb87-02ca-45d0-8340-bf9f37299d81,What type of meal is the Caesar Salad considered as
70d3cb87-02ca-45d0-8340-bf9f37299d81,How long does it take to prepare the Caesar Salad
70d3cb87-02ca-45d0-8340-bf9f37299d81,Is the Caesar Salad suitable for vegetarians
70d3cb87-02ca-45d0-8340-bf9f37299d81,At what temperature should the Caesar Salad be served
70d3cb87-02ca-45d0-8340-bf9f37299d81,Does the preparation of the Caesar Salad require any cooking
c129871b-49b7-4a9f-aff8-6898e0bc9e91,What are the main ingredients required to make Bangers and Mash?
c129871b-49b7-4a9f-aff8-6898e0bc9e91,How long does it take to prepare and cook Bangers and Mash?
c129871b-49b7-4a9f-aff8-6898e0bc9e91,What is the primary method used to cook the sausages in Bangers and Mash?
c129871b-49b7-4a9f-aff8-6898e0bc9e91,Is Bangers and Mash suitable for a vegetarian diet?
c129871b-49b7-4a9f-aff8-6898e0bc9e91,What is the recommended temperature for serving Bangers and Mash?
b823e0ff-7563-473d-afc1-a9e911440296,What type of meal is Moules-Frites and how long does it take to prepare?
b823e0ff-7563-473d-afc1-a9e911440296,Is Moules-Frites suitable for vegetarians and what is the main cooking method?
b823e0ff-7563-473d-afc1-a9e911440296,What ingredients are used to make Moules-Frites and at what temperature is it served?
b823e0ff-7563-473d-afc1-a9e911440296,What is the spice level of Moules-Frites and are there any specific instructions for serving?
b823e0ff-7563-473d-afc1-a9e911440296,"How do I make Moules-Frites, including the preparation of the mussels and the fries?"
27e1d5f7-9e92-446f-aea9-19a45b6beacc,What is the primary vegetable used in Baba Ghanoush?
27e1d5f7-9e92-446f-aea9-19a45b6beacc,How long does it take to prepare Baba Ghanoush in total?
27e1d5f7-9e92-446f-aea9-19a45b6beacc,Is Baba Ghanoush suitable for a vegetarian diet?
27e1d5f7-9e92-446f-aea9-19a45b6beacc,At what temperature is Baba Ghanoush typically served?
27e1d5f7-9e92-446f-aea9-19a45b6beacc,What is the main method used to combine ingredients in Baba Ghanoush?
23fa830a-1732-46d6-b416-53704b29f1ac,What are the ingredients required to make Chicken Mole?
23fa830a-1732-46d6-b416-53704b29f1ac,Is Chicken Mole a vegetarian meal option?
23fa830a-1732-46d6-b416-53704b29f1ac,What is the main cooking method used to prepare Chicken Mole?
23fa830a-1732-46d6-b416-53704b29f1ac,How long does it take to cook Chicken Mole in minutes?
23fa830a-1732-46d6-b416-53704b29f1ac,At what temperature should Chicken Mole be served?
faffb1ac-6c1b-428f-8aeb-b8437d6897fd,What type of meal is Tteokbokki classified as?
faffb1ac-6c1b-428f-8aeb-b8437d6897fd,How long does it take to cook Tteokbokki?
faffb1ac-6c1b-428f-8aeb-b8437d6897fd,Is Tteokbokki suitable for a vegetarian diet?
faffb1ac-6c1b-428f-8aeb-b8437d6897fd,What is the primary method used to cook Tteokbokki?
faffb1ac-6c1b-428f-8aeb-b8437d6897fd,At what temperature should Tteokbokki be served?
360016ce-2be5-4ae8-9e90-46c7ac50ea80,What are the main ingredients used to make Dumplings?
360016ce-2be5-4ae8-9e90-46c7ac50ea80,How long does it take to cook Dumplings?
360016ce-2be5-4ae8-9e90-46c7ac50ea80,What are the possible methods to cook Dumplings?
360016ce-2be5-4ae8-9e90-46c7ac50ea80,Is Dumplings suitable for a vegetarian diet?
360016ce-2be5-4ae8-9e90-46c7ac50ea80,At what temperature should Dumplings be served?
b60e7989-1087-4155-b3e1-de00d8ade3af,What are the ingredients used to make Cornish Pasty?
b60e7989-1087-4155-b3e1-de00d8ade3af,How long does it take to cook a Cornish Pasty?
b60e7989-1087-4155-b3e1-de00d8ade3af,Is Cornish Pasty suitable for vegetarians?
b60e7989-1087-4155-b3e1-de00d8ade3af,What is the primary method of cooking used for Cornish Pasty?
b60e7989-1087-4155-b3e1-de00d8ade3af,At what temperature should Cornish Pasty be served?
22220de8-0e3a-4f55-a940-6d2c1f08024e,What type of meal is Chicken Satay classified as?
22220de8-0e3a-4f55-a940-6d2c1f08024e,How long does it take to cook Chicken Satay?
22220de8-0e3a-4f55-a940-6d2c1f08024e,Is Chicken Satay suitable for a vegetarian diet?
22220de8-0e3a-4f55-a940-6d2c1f08024e,What is the primary method used to cook Chicken Satay?
22220de8-0e3a-4f55-a940-6d2c1f08024e,At what temperature should Chicken Satay be served?
2dc2ccd6-b746-45cd-864d-e17850678971,What type of meal is Chilaquiles typically considered?
2dc2ccd6-b746-45cd-864d-e17850678971,How long does it take to prepare Chilaquiles?
2dc2ccd6-b746-45cd-864d-e17850678971,Is Chilaquiles suitable for a vegetarian diet?
2dc2ccd6-b746-45cd-864d-e17850678971,What is the recommended serving temperature for Chilaquiles?
2dc2ccd6-b746-45cd-864d-e17850678971,What is the primary method used to cook Chilaquiles?
64144ace-3fd8-49d8-bd62-0cf7688c448a,What are the primary ingredients used to make Aloo Gobi?
64144ace-3fd8-49d8-bd62-0cf7688c448a,How long does it take to cook Aloo Gobi?
64144ace-3fd8-49d8-bd62-0cf7688c448a,Is Aloo Gobi suitable for vegetarians and what type of meal is it?
64144ace-3fd8-49d8-bd62-0cf7688c448a,What is the recommended serving temperature for Aloo Gobi?
64144ace-3fd8-49d8-bd62-0cf7688c448a,What steps are involved in preparing Aloo Gobi?
6b0f9b2e-cdc1-4501-9e84-cdd9c3f2726f,What type of meal is Feijoada and what is its spice level?
6b0f9b2e-cdc1-4501-9e84-cdd9c3f2726f,How long does it take to cook Feijoada and at what temperature is it served?
6b0f9b2e-cdc1-4501-9e84-cdd9c3f2726f,Is Feijoada suitable for vegetarians and what is the main cooking method used?
6b0f9b2e-cdc1-4501-9e84-cdd9c3f2726f,What ingredients are used to make Feijoada and how are they prepared?
6b0f9b2e-cdc1-4501-9e84-cdd9c3f2726f,What is the main cooking instruction to make Feijoada tender and flavorful?
f17d2b07-f584-4601-b558-90fc24181433,What is the main cooking method required to make Huevos Rancheros?
f17d2b07-f584-4601-b558-90fc24181433,Is Huevos Rancheros suitable for a vegetarian diet?
f17d2b07-f584-4601-b558-90fc24181433,What is the recommended serving temperature for Huevos Rancheros?
f17d2b07-f584-4601-b558-90fc24181433,How long does it take to cook Huevos Rancheros in minutes?
f17d2b07-f584-4601-b558-90fc24181433,What type of meal is Huevos Rancheros classified as?
372107fb-2e45-42dc-8e31-cdb2efbb6bb1,What ingredients are required to make Shrimp Scampi?
372107fb-2e45-42dc-8e31-cdb2efbb6bb1,How long does it take to cook Shrimp Scampi?
372107fb-2e45-42dc-8e31-cdb2efbb6bb1,Is Shrimp Scampi suitable for vegetarians?
372107fb-2e45-42dc-8e31-cdb2efbb6bb1,What is the recommended serving temperature for Shrimp Scampi?
372107fb-2e45-42dc-8e31-cdb2efbb6bb1,What are the steps to prepare Shrimp Scampi?
000f9fa6-8cbf-43ca-9409-1d018e93956f,What is the primary protein ingredient in Chicken Parmigiana?
000f9fa6-8cbf-43ca-9409-1d018e93956f,How long does it take to cook Chicken Parmigiana in total?
000f9fa6-8cbf-43ca-9409-1d018e93956f,Is Chicken Parmigiana suitable for a vegetarian diet?
000f9fa6-8cbf-43ca-9409-1d018e93956f,What is the final step in cooking Chicken Parmigiana after frying the chicken?
000f9fa6-8cbf-43ca-9409-1d018e93956f,At what temperature should Chicken Parmigiana be served?
32bc5c0e-1d7b-47d8-9e0d-e1e90ade099a,What ingredients are used to make Ye'abesha Gomen
32bc5c0e-1d7b-47d8-9e0d-e1e90ade099a,How long does it take to cook Ye'abesha Gomen
32bc5c0e-1d7b-47d8-9e0d-e1e90ade099a,Is Ye'abesha Gomen a vegetarian meal
32bc5c0e-1d7b-47d8-9e0d-e1e90ade099a,What is the main cooking method for Ye'abesha Gomen
32bc5c0e-1d7b-47d8-9e0d-e1e90ade099a,What is the serving temperature of Ye'abesha Gomen
7a4ceb7e-c46c-49df-b66d-b791275cd5b0,What ingredients do I need to make Zigni?
7a4ceb7e-c46c-49df-b66d-b791275cd5b0,How long does it take to cook Zigni?
7a4ceb7e-c46c-49df-b66d-b791275cd5b0,Is Zigni suitable for vegetarians?
7a4ceb7e-c46c-49df-b66d-b791275cd5b0,What is the main cooking method used to prepare Zigni?
7a4ceb7e-c46c-49df-b66d-b791275cd5b0,What is the recommended serving temperature for Zigni?
3455de12-a918-437f-a95f-fea0b7314cae,What type of flour is used to make Galettes?
3455de12-a918-437f-a95f-fea0b7314cae,How long does it take to cook Galettes?
3455de12-a918-437f-a95f-fea0b7314cae,What is the main cooking method for Galettes?
3455de12-a918-437f-a95f-fea0b7314cae,Are Galettes suitable for a vegetarian diet?
3455de12-a918-437f-a95f-fea0b7314cae,What ingredients are used to fill Galettes after cooking?
cb90f084-efac-4a3b-a39b-ee7e669d8d0c,What type of meal is Fufu typically served as?
cb90f084-efac-4a3b-a39b-ee7e669d8d0c,How long does it take to cook Fufu?
cb90f084-efac-4a3b-a39b-ee7e669d8d0c,Is Fufu suitable for a vegetarian diet?
cb90f084-efac-4a3b-a39b-ee7e669d8d0c,At what temperature should Fufu be served?
cb90f084-efac-4a3b-a39b-ee7e669d8d0c,What is the main cooking method used to prepare Fufu?
fa6ac7a8-b74c-4811-98c6-709419a874ff,What are the main ingredients used to make Cacio e Pepe?
fa6ac7a8-b74c-4811-98c6-709419a874ff,Is Cacio e Pepe suitable for a vegetarian diet?
fa6ac7a8-b74c-4811-98c6-709419a874ff,How long does it take to cook Cacio e Pepe?
fa6ac7a8-b74c-4811-98c6-709419a874ff,What is the primary method used to cook Cacio e Pepe?
fa6ac7a8-b74c-4811-98c6-709419a874ff,At what temperature should Cacio e Pepe be served?
f8f283ed-bbaf-4915-9908-68ebdb0c94e6,What type of meat is used to make Kofta Curry?
f8f283ed-bbaf-4915-9908-68ebdb0c94e6,How long does it take to cook Kofta Curry?
f8f283ed-bbaf-4915-9908-68ebdb0c94e6,Is Kofta Curry suitable for vegetarians?
f8f283ed-bbaf-4915-9908-68ebdb0c94e6,At what temperature should Kofta Curry be served?
f8f283ed-bbaf-4915-9908-68ebdb0c94e6,What is the main cooking method used to prepare Kofta Curry?
28dcd2cb-0882-47d6-b66f-3dad40016414,What are the main ingredients required to make Chicken Katsu?
28dcd2cb-0882-47d6-b66f-3dad40016414,How long does it take to cook Chicken Katsu in total?
28dcd2cb-0882-47d6-b66f-3dad40016414,Is Chicken Katsu a suitable option for vegetarians?
28dcd2cb-0882-47d6-b66f-3dad40016414,What is the primary method of cooking Chicken Katsu?
28dcd2cb-0882-47d6-b66f-3dad40016414,At what temperature should Chicken Katsu be served to the customer?
db5d785f-847a-47af-8e9a-846294888741,What are the main ingredients used to make Onigiri?
db5d785f-847a-47af-8e9a-846294888741,How long does it take to prepare Onigiri?
db5d785f-847a-47af-8e9a-846294888741,Is Onigiri suitable for vegetarians and what is the spice level of the dish?
db5d785f-847a-47af-8e9a-846294888741,What are the steps involved in shaping and filling Onigiri?
db5d785f-847a-47af-8e9a-846294888741,At what temperature is Onigiri typically served and what are some common fillings used?
865d6381-f4ad-4125-946f-6174e69032dc,What type of meal is Steak Frites classified as?
865d6381-f4ad-4125-946f-6174e69032dc,How long does it take to cook Steak Frites in total?
865d6381-f4ad-4125-946f-6174e69032dc,Is Steak Frites suitable for vegetarians?
865d6381-f4ad-4125-946f-6174e69032dc,What is the primary method used to cook the steak in Steak Frites?
865d6381-f4ad-4125-946f-6174e69032dc,At what temperature is Steak Frites typically served?
4416e695-108e-4e04-8a35-706970a453f4,What are the key ingredients required to make Shepherd's Pie?
4416e695-108e-4e04-8a35-706970a453f4,How long does it take to cook Shepherd's Pie in the oven?
4416e695-108e-4e04-8a35-706970a453f4,Is Shepherd's Pie suitable for vegetarians?
4416e695-108e-4e04-8a35-706970a453f4,What is the primary cooking method used to prepare Shepherd's Pie?
4416e695-108e-4e04-8a35-706970a453f4,At what temperature is Shepherd's Pie typically served?
88303878-41e7-4e85-8c50-0da9800a8526,What type of meal is Chicken Tikka considered?
88303878-41e7-4e85-8c50-0da9800a8526,Is Chicken Tikka suitable for vegetarians?
88303878-41e7-4e85-8c50-0da9800a8526,How long does it take to cook Chicken Tikka?
88303878-41e7-4e85-8c50-0da9800a8526,What is the primary method used to cook Chicken Tikka?
88303878-41e7-4e85-8c50-0da9800a8526,At what temperature should Chicken Tikka be served?
233b37b9-3907-44e5-8590-8096102751a0,What type of meal is Pad Kee Mao and how long does it take to cook?
233b37b9-3907-44e5-8590-8096102751a0,Is Pad Kee Mao suitable for vegetarians and what is its spice level?
233b37b9-3907-44e5-8590-8096102751a0,What ingredients are used in Pad Kee Mao and how are they prepared?
233b37b9-3907-44e5-8590-8096102751a0,What is the main cooking method used for Pad Kee Mao and at what temperature is it served?
233b37b9-3907-44e5-8590-8096102751a0,How do I make Pad Kee Mao with the given ingredients and what is the resulting flavor profile?
47734007-2544-4d23-9deb-b57411a199db,What type of meat is used in the Saltimbocca recipe?
47734007-2544-4d23-9deb-b57411a199db,How long does it take to cook Saltimbocca?
47734007-2544-4d23-9deb-b57411a199db,What is the main cooking method for Saltimbocca?
47734007-2544-4d23-9deb-b57411a199db,Is Saltimbocca suitable for vegetarians?
47734007-2544-4d23-9deb-b57411a199db,At what temperature should Saltimbocca be served?
880eeb49-957e-4196-823d-12dc9df3295a,What is the main ingredient in the Carne Asada dish?
880eeb49-957e-4196-823d-12dc9df3295a,How long does it take to cook the Carne Asada?
880eeb49-957e-4196-823d-12dc9df3295a,What is the appropriate serving temperature for Carne Asada?
880eeb49-957e-4196-823d-12dc9df3295a,Is Carne Asada suitable for a vegetarian diet?
880eeb49-957e-4196-823d-12dc9df3295a,What method is used to cook the beef in the Carne Asada recipe?
a687ab7a-4186-4d12-8bac-06e0a4fb5325,What are the ingredients required to make Chicken Cordon Bleu?
a687ab7a-4186-4d12-8bac-06e0a4fb5325,Is Chicken Cordon Bleu a suitable option for vegetarians?
a687ab7a-4186-4d12-8bac-06e0a4fb5325,How long does it take to cook Chicken Cordon Bleu?
a687ab7a-4186-4d12-8bac-06e0a4fb5325,What is the recommended serving temperature for Chicken Cordon Bleu?
a687ab7a-4186-4d12-8bac-06e0a4fb5325,What is the primary method used to cook Chicken Cordon Bleu?
41f232aa-7e31-4f19-9124-61a15ebc7803,What type of sauce is typically served with Peking Duck Pancakes?
41f232aa-7e31-4f19-9124-61a15ebc7803,How long does it take to prepare Peking Duck Pancakes?
41f232aa-7e31-4f19-9124-61a15ebc7803,What is the main ingredient in Peking Duck Pancakes?
41f232aa-7e31-4f19-9124-61a15ebc7803,At what temperature should Peking Duck Pancakes be served?
41f232aa-7e31-4f19-9124-61a15ebc7803,Is Peking Duck Pancakes a suitable option for a vegetarian meal?
ca13459c-7ec3-4353-b8c1-78fe17edc11c,What type of meal is Fish Tacos considered?
ca13459c-7ec3-4353-b8c1-78fe17edc11c,How long does it take to prepare Fish Tacos?
ca13459c-7ec3-4353-b8c1-78fe17edc11c,What method is used to cook the fish in Fish Tacos?
ca13459c-7ec3-4353-b8c1-78fe17edc11c,Is Fish Tacos suitable for a vegetarian diet?
ca13459c-7ec3-4353-b8c1-78fe17edc11c,At what temperature should Fish Tacos be served?
d306030a-75d6-4421-8c87-788b35610eb3,What are the main ingredients needed to make Tarte Tatin?
d306030a-75d6-4421-8c87-788b35610eb3,How long does it take to cook Tarte Tatin in the oven?
d306030a-75d6-4421-8c87-788b35610eb3,Is Tarte Tatin suitable for vegetarians to eat?
d306030a-75d6-4421-8c87-788b35610eb3,What is the recommended serving temperature for Tarte Tatin?
d306030a-75d6-4421-8c87-788b35610eb3,What is the primary method of cooking used to prepare Tarte Tatin?
af8ac077-66e4-40ee-bf79-00324941f9f4,What are the ingredients needed to make Dim Sum?
af8ac077-66e4-40ee-bf79-00324941f9f4,How long does it take to cook Dim Sum?
af8ac077-66e4-40ee-bf79-00324941f9f4,What is the main cooking method used for Dim Sum?
af8ac077-66e4-40ee-bf79-00324941f9f4,Is Dim Sum suitable for vegetarians?
af8ac077-66e4-40ee-bf79-00324941f9f4,At what temperature should Dim Sum be served?
4b4a1d1f-c3ff-41a3-a5ad-04258da48bd8,What are the key ingredients used to make Tamales?
4b4a1d1f-c3ff-41a3-a5ad-04258da48bd8,How long does it take to cook Tamales in total?
4b4a1d1f-c3ff-41a3-a5ad-04258da48bd8,Is Tamales a suitable option for a vegetarian diet?
4b4a1d1f-c3ff-41a3-a5ad-04258da48bd8,What is the primary method of cooking used to prepare Tamales?
4b4a1d1f-c3ff-41a3-a5ad-04258da48bd8,At what temperature are Tamales typically served?
b6129a62-22bb-4f0d-ad6b-3d83189f340f,What type of meal is Chicken and Dumplings classified as?
b6129a62-22bb-4f0d-ad6b-3d83189f340f,How long does it take to cook Chicken and Dumplings?
b6129a62-22bb-4f0d-ad6b-3d83189f340f,Is Chicken and Dumplings suitable for a vegetarian diet?
b6129a62-22bb-4f0d-ad6b-3d83189f340f,What is the primary method used to cook Chicken and Dumplings?
b6129a62-22bb-4f0d-ad6b-3d83189f340f,At what temperature should Chicken and Dumplings be served?
57185951-f4cc-4f02-8b2a-2f03a4bc9358,What type of meal is Tzatziki typically considered
57185951-f4cc-4f02-8b2a-2f03a4bc9358,How long does it take to prepare Tzatziki
57185951-f4cc-4f02-8b2a-2f03a4bc9358,Is Tzatziki suitable for a vegetarian diet
57185951-f4cc-4f02-8b2a-2f03a4bc9358,What is the ideal temperature for serving Tzatziki
57185951-f4cc-4f02-8b2a-2f03a4bc9358,What are the steps to make Tzatziki from scratch
8f03b61d-e6e3-490e-92da-04bc8d207b18,What type of meal are Croquettes typically served as?
8f03b61d-e6e3-490e-92da-04bc8d207b18,Do Croquettes contain any meat ingredients?
8f03b61d-e6e3-490e-92da-04bc8d207b18,How long does it take to cook Croquettes?
8f03b61d-e6e3-490e-92da-04bc8d207b18,What is the main method used to cook Croquettes?
8f03b61d-e6e3-490e-92da-04bc8d207b18,At what temperature are Croquettes usually served?
747bd755-d866-45b0-a6ea-d140a3f50f07,What type of meat is required to make Chimichurri Steak?
747bd755-d866-45b0-a6ea-d140a3f50f07,How long does it take to cook Chimichurri Steak?
747bd755-d866-45b0-a6ea-d140a3f50f07,Is Chimichurri Steak suitable for vegetarians?
747bd755-d866-45b0-a6ea-d140a3f50f07,What is the recommended serving temperature for Chimichurri Steak?
747bd755-d866-45b0-a6ea-d140a3f50f07,What is the primary method used to cook Chimichurri Steak?
216e7c5f-f835-4e03-be96-87da9a70b837,What type of meal is Polenta classified as?
216e7c5f-f835-4e03-be96-87da9a70b837,How long does it take to cook Polenta in minutes?
216e7c5f-f835-4e03-be96-87da9a70b837,Is Polenta suitable for a vegetarian diet?
216e7c5f-f835-4e03-be96-87da9a70b837,What is the primary method used to cook Polenta?
216e7c5f-f835-4e03-be96-87da9a70b837,At what temperature should Polenta be served?
36d849e4-35c1-4848-84e2-987fd1b33b9d,What are the main ingredients used to make Mitarashi Dango
36d849e4-35c1-4848-84e2-987fd1b33b9d,Is Mitarashi Dango suitable for a vegetarian diet
36d849e4-35c1-4848-84e2-987fd1b33b9d,How long does it take to cook Mitarashi Dango
36d849e4-35c1-4848-84e2-987fd1b33b9d,What is the primary method used to cook Mitarashi Dango
36d849e4-35c1-4848-84e2-987fd1b33b9d,At what temperature is Mitarashi Dango typically served
